name,address,email,website,phone_number,company,job,text,date_time,country,state,city,pin_code
Reyansh Date,"71/207
Rege Nagar, Katihar-137866",azad58@example.net,https://www.nayak-virk.com/,07067238884,Dixit and Sons,Immunologist,Aliquam nam labore assumenda nisi. Fugit sed ut aliquid fugit doloremque possimus. Dolores iure necessitatibus labore enim.,2017-10-04 07:46:58,Equatorial Guinea,Karnataka,Bally,300587
Mohammed Pingle,"49
Sen Zila, Sasaram-249961",vyanjana56@example.org,https://magar.com/,4152146093,Kapur Inc,Psychotherapist,Totam laudantium excepturi. Nam nam repudiandae magni temporibus suscipit.,2003-04-17 00:36:22,Hungary,Uttar Pradesh,Bhalswa Jahangir Pur,862131
David Mann,"58, Thakkar Road
South Dumdum-955485",gbath@example.com,https://www.verma.com/,+916276220572,"Walia, Suri and Balakrishnan",Medical technical officer,Totam omnis reprehenderit quam dolorum officiis. Eaque dolorum sunt maiores qui. Expedita expedita veritatis maiores voluptate maxime exercitationem.,2014-01-27 14:54:24,Romania,Bihar,Ichalkaranji,656047
Fiyaz Bhat,"88/90
Dar Nagar, Raichur 883240",labanloke@example.com,http://bhardwaj.com/,04132589134,Devi-Saraf,Information systems manager,Iure excepturi cumque deleniti velit unde. Vitae ipsa saepe nulla incidunt eveniet.,1977-05-25 03:20:26,Jordan,Haryana,Jabalpur,695319
Gautam Gupta,"H.No. 945, Bhargava Road
Serampore-273576",hardik84@example.net,https://www.saha.org/,+919186212041,Sunder-Patil,IT trainer,"Dignissimos unde numquam. Officia delectus sint totam neque tenetur.
Eveniet consectetur sed iure cum fugit. Ex facere placeat blanditiis quisquam nam ratione iure.",1991-05-09 12:42:22,Democratic Republic of the Congo,Haryana,Bhilai,932343
Rajeshri Batta,"H.No. 636
Kothari Nagar, Parbhani 555998",vivaan47@example.net,http://dutt.biz/,+917314267297,Swamy-Iyer,Newspaper journalist,Quia reiciendis expedita quaerat mollitia earum ut. Earum eligendi iusto quam. Officiis expedita ullam.,2021-06-18 06:02:31,Spain,Andhra Pradesh,Satara,296214
Farhan Rajagopal,"71, Banerjee Chowk, Anantapuram-454866",faras50@example.org,http://rao.com/,06375225656,Keer-Raval,Commercial horticulturist,Officia enim saepe earum eos sequi qui sapiente. Magni eius error non accusamus. Ab dolore nobis corporis aspernatur beatae provident.,1975-05-04 13:09:30,Luxembourg,Goa,Ambarnath,348861
Warjas Menon,"H.No. 51, Kant Road
Tirupati 099984",warhicomar@example.org,https://sachdeva-borde.biz/,+912652860905,"Dayal, Rana and Keer",Sports therapist,"Molestias iusto et at doloremque tempore. Facilis accusamus temporibus.
Quo totam commodi odio blanditiis dolor. Cumque doloribus numquam ullam fuga temporibus fugiat maxime.",1985-04-11 14:13:56,Laos,Punjab,Vellore,902494
Imaran Narula,"H.No. 404
Grover Street
Rourkela 447878",nidra46@example.com,https://www.ratti.org/,03437294598,"Zachariah, Naidu and Parikh",Aid worker,Nam voluptates voluptatibus at. Nesciunt nostrum reprehenderit aut mollitia expedita odio. Quaerat neque dicta culpa fugit quas perspiciatis.,1978-08-09 21:59:40,Democratic Republic of the Congo,Bihar,Hazaribagh,809389
Ekansh Varkey,"17
Sekhon Nagar, Loni-328448",wridesh26@example.net,https://bora-bora.net/,09712581480,Halder-Ramachandran,Writer,"Non asperiores saepe iure. Distinctio ipsum error cum fugit. Numquam perferendis unde odio ea.
Nobis dolor vitae. Minima rerum architecto sequi.",2011-02-24 12:30:03,Nauru,Himachal Pradesh,Farrukhabad,252705
Gagan Saraf,"H.No. 197, Shroff Nagar
Rohtak-872686",moreayushman@example.org,https://www.prashad-bhatti.com/,04641878240,"Gole, Sidhu and Nagar",Social researcher,Totam nesciunt libero iusto maxime reprehenderit. Ipsa repudiandae nam. Corrupti expedita expedita mollitia quasi accusamus eligendi.,2015-12-08 23:49:18,Taiwan,Tripura,Bijapur,873310
Adweta More,"46/792
Bassi, Gaya-595116",darakiaan@example.net,https://www.sachdev-keer.com/,0083905356,Ganesan LLC,Scientific laboratory technician,Voluptate fugiat beatae sed. Nobis quae distinctio occaecati nihil suscipit quae. Quod iste ab temporibus quas illum. Ipsam numquam modi sed debitis ratione facilis accusantium.,1983-03-23 14:20:55,Ecuador,Madhya Pradesh,Tumkur,387795
Isaac Goyal,"H.No. 21, Varkey Road
Erode 272386",liamvarkey@example.com,https://pingle-tata.com/,3038925686,Bora-Varty,"Engineer, energy",Eligendi corporis voluptatibus. Aliquid est expedita maiores est voluptatem.,2016-04-28 03:58:30,India,Jharkhand,Naihati,493667
Zaid Lad,"H.No. 760
Pau Circle, Gurgaon-905202",advaychandra@example.net,https://sengupta-desai.com/,+910344905307,Narayan-Chand,Barrister's clerk,"Expedita accusantium cum est deserunt laudantium dolor.
Consequuntur perspiciatis autem officia. Voluptate quidem harum quisquam. Saepe aspernatur quam impedit dolor deleniti quasi iusto.",1987-01-17 16:07:17,Libya,Maharashtra,Amritsar,824483
Ladli Jani,"H.No. 95, Lanka Chowk
Muzaffarnagar-738158",cheemaadvik@example.org,http://www.bajwa-krishnan.com/,05456214523,Zacharia Inc,Seismic interpreter,Quod sed modi recusandae officia dicta. Vitae itaque sapiente at ipsa laudantium ipsa. Amet perferendis saepe laboriosam id ipsa facilis.,2024-12-09 17:07:32,Belize,Himachal Pradesh,Aligarh,917911
Yadavi Lall,"H.No. 774, Kade Road, Patiala-017552",gaurikaswamy@example.com,https://www.bose.com/,08009850734,"Mani, Gour and Mutti",Acupuncturist,Nobis consequuntur est vero eveniet porro nesciunt. Quis similique nesciunt mollitia soluta doloremque.,1982-06-04 03:59:55,Lebanon,Manipur,Jaunpur,771511
Eesha Mahajan,"19/474
Chaudhari Street
Hosur-264961",chakradhardave@example.net,https://www.jha-kothari.com/,+910868056222,"Garg, Dey and Shetty",Occupational psychologist,Porro nisi id impedit. Molestiae vel corporis nostrum temporibus nulla cupiditate. Tempora reprehenderit illo sint temporibus.,1991-01-22 23:17:05,Kyrgyzstan,Manipur,Bikaner,506103
Barkha Kakar,"65/45, Prabhu Zila, Chinsurah-336811",nparmer@example.org,http://www.raman.biz/,01275306649,"Shere, Cherian and Bhakta",Television/film/video producer,"Ullam odio cum laudantium cupiditate. Perspiciatis quibusdam ea cupiditate consectetur. Quo atque id officiis perferendis incidunt qui.
Dolorum placeat error quia.",1997-06-12 12:14:50,Maldives,Goa,Motihari,763305
Christopher Gara,"H.No. 024
Dyal Ganj, Pallavaram-115778",ssalvi@example.org,http://narain-gour.info/,07827098273,Puri-Malhotra,Banker,"Exercitationem rerum facere suscipit.
Iusto sint ullam. Debitis eum tenetur. At dicta placeat dolorem consequatur eum perspiciatis.
Pariatur tempore sed blanditiis deleniti repellendus.",2009-08-21 22:31:52,Marshall Islands,Karnataka,Machilipatnam,169082
Yochana Nagi,"66
Pathak Chowk, Dindigul 712642",janakisethi@example.org,https://www.bhagat-vaidya.com/,7277803656,"Iyengar, Sidhu and Tiwari","Civil engineer, consulting","Quaerat architecto debitis repellendus. Dicta itaque quam quisquam odit sapiente omnis. Sed odio sint repudiandae deleniti vero magnam in.
Quisquam ex quasi soluta. Repellat optio repellendus vitae.",1996-04-17 08:52:52,Turkey,Kerala,Bikaner,011656
Tanish Dugar,"H.No. 494
Mandal Path, Davanagere-520938",lbhakta@example.com,http://www.gupta-karpe.com/,05723755423,"Kapoor, Mane and Kashyap",Careers information officer,Beatae omnis quam provident dignissimos natus inventore itaque. Quidem doloribus rerum. Similique soluta dolor non. Nesciunt aperiam ipsam dignissimos eum omnis.,1995-06-10 21:58:10,Madagascar,Himachal Pradesh,Kanpur,421441
Sanya Jani,"H.No. 521, Gandhi Circle, Katihar 146840",gaurang43@example.org,https://www.palla-minhas.info/,09185149104,"Lall, Patla and Choudhary",Secondary school teacher,"Exercitationem nisi ratione. Occaecati placeat voluptatem recusandae cupiditate.
Aliquid optio magnam ducimus eligendi harum molestias quas. Qui commodi quidem.",1973-10-11 02:13:25,Spain,Haryana,Rajpur Sonarpur,050789
Shivani Raval,"41, Gala Zila
Khandwa 453875",vnazareth@example.com,https://patel-rajagopal.info/,5873279265,Mitter-Pai,Theatre manager,"Nemo fuga suscipit dolore nobis non. Soluta voluptate deleniti dolores voluptatem provident.
Voluptatum consequuntur dolore sint. Explicabo architecto error fuga.",2015-03-12 03:58:25,Kyrgyzstan,Bihar,Tadipatri,918663
Caleb Ramakrishnan,"405, Keer Marg
Imphal-883744",nandajacob@example.org,http://www.kamdar.com/,+912774437443,"Chanda, Seth and Bhat","Accountant, chartered public finance",Ratione modi eos ex fugit dignissimos. Veritatis illo perspiciatis officiis. Magnam necessitatibus ut a.,1980-08-23 20:07:34,Rwanda,Chhattisgarh,Khora ,985802
Frado Boase,"26, Vasa Circle, Burhanpur 234303",dalbir08@example.com,https://joshi.org/,+911134979999,Bhakta Inc,"Programme researcher, broadcasting/film/video",Pariatur dolore eum. Impedit cumque atque atque. Tempore maiores ipsam provident aliquam illo non. Laudantium esse consectetur laboriosam sequi aspernatur.,1994-12-15 21:53:06,El Salvador,Kerala,Morbi,916199
Omya Bhasin,"36
Murthy Zila, Bhimavaram 943130",ugoswami@example.org,https://aggarwal.org/,7813326345,Ratti Inc,Air cabin crew,Cupiditate fugiat eligendi molestiae eaque. Voluptatum quos laborum officiis vitae.,1975-08-30 04:57:31,Afghanistan,Maharashtra,Kanpur,308303
Fitan Sekhon,"93/018
Kata Zila
Malegaon 539682",siddharth38@example.net,https://tak.info/,+913545626802,Gour-Sridhar,Applications developer,"Id quidem animi quidem.
Eum possimus praesentium. Magnam ullam quae rerum corrupti doloremque.",1998-12-14 18:25:44,Croatia,Maharashtra,Mira-Bhayandar,222721
Upadhriti Sarkar,"479
Solanki Street
Vellore 336885",dashemangini@example.org,https://lata.com/,+915747443482,Amble and Sons,"Administrator, Civil Service",Sequi minus libero placeat officia. Autem veniam quasi perspiciatis architecto fugit.,1996-05-01 02:48:31,Slovakia,Chhattisgarh,Dehradun,255352
Mohammed Bassi,"84/56, Sheth Nagar
Parbhani-284245",fariqseth@example.com,http://sen.com/,05255944739,"Chadha, Ravel and Padmanabhan","Geologist, engineering","Illum eum dolorem repellendus minima accusamus sint.
Nulla tenetur tempora quia culpa aliquam illum natus. Animi labore illo non reprehenderit molestiae odio. Expedita minus quisquam sed error quis.",2016-01-22 13:05:04,Russia,Andhra Pradesh,Ratlam,294200
Sneha Upadhyay,"11/07, Sanghvi Zila
Ramagundam-123357",farhanamble@example.net,http://anand.org/,+917234711255,Palan-Srinivas,Heritage manager,Error velit et inventore. Eveniet doloribus excepturi. Nisi necessitatibus veniam adipisci magnam.,2019-06-15 01:00:20,Botswana,Maharashtra,Agartala,743974
Bhavini Mani,"100
Sundaram
Ongole 067641",bhavinikadakia@example.net,https://palan.com/,+919001132598,Kanda-Bhakta,Claims inspector/assessor,Velit sit aperiam dolores qui. Dignissimos hic soluta. Quis magni numquam suscipit dolore reprehenderit. Vero corporis quibusdam esse possimus.,1987-03-27 06:36:28,Gabon,Telangana,Karawal Nagar,459340
Ayush Natarajan,"H.No. 691, Dugal, Aurangabad-487459",tdhawan@example.net,https://acharya-dutt.com/,01704083568,Walla-Khatri,Veterinary surgeon,Ratione numquam commodi nisi pariatur corrupti beatae. Alias sunt alias architecto quas.,1972-06-01 07:51:38,Chile,Meghalaya,Guntakal,932700
Vivaan Kunda,"748
Sanghvi Zila, Nellore 841262",udarshrandhawa@example.org,http://www.tailor-sagar.net/,09668724701,Ram-Dar,Hospital doctor,"Sapiente neque fuga necessitatibus qui libero sint. Nihil ullam odio harum. Vitae cumque ut magnam.
Officiis itaque ipsum ut sit amet autem.",1976-01-15 17:00:30,North Korea,Mizoram,Gaya,070465
Onkar Zacharia,"85/99, Sharaf Road
Tenali-509523",janujaparsa@example.net,https://andra-malhotra.biz/,05328614634,Sengupta-Jaggi,"Engineer, maintenance (IT)",Quaerat porro harum amet. Id sequi esse.,1994-04-27 04:39:25,Republic of Ireland,Assam,Raipur,122863
Warda Sankaran,"H.No. 304
Chatterjee Marg
Alappuzha 362684",doshilavanya@example.org,https://bains.info/,+918787714055,"Shankar, Muni and Patil",Arboriculturist,Voluptatum quos veniam sequi enim consequuntur asperiores laudantium. Minus quos tempore soluta expedita occaecati. Reiciendis molestiae dolorum.,2014-12-21 21:32:46,Panama,Madhya Pradesh,Thoothukudi,824214
Chakradev Palan,"38/27
Barad Street
Morbi-184193",meghana42@example.com,http://www.yogi.info/,+916667351208,Seth-Hegde,"Sales professional, IT",Atque tenetur corrupti odio nulla voluptas. Necessitatibus ratione ipsa omnis atque. Inventore vel repudiandae.,2008-05-15 13:49:51,Pakistan,Mizoram,Aurangabad,153207
Jagvi Hans,"46/307, Bava
Danapur 239117",chopramadhavi@example.com,http://kibe-radhakrishnan.com/,+912647398295,Rajagopal Ltd,Physiotherapist,"Autem repellat corporis adipisci voluptates neque. Quasi temporibus modi facere unde itaque.
Omnis nemo dolor rem. Repellat mollitia ratione quia adipisci quia incidunt possimus.",1975-03-31 06:16:21,Kuwait,Meghalaya,Giridih,804878
Manbir Sami,"H.No. 40
Kapadia Zila, Sambalpur-670226",kalitapraneel@example.com,http://www.upadhyay-memon.biz/,08658625474,Sandal Inc,"Programme researcher, broadcasting/film/video","Mollitia pariatur fugiat praesentium. Nesciunt vero dolore earum dolorum.
Excepturi similique quod facere.",2019-02-02 20:48:33,San Marino,Goa,Ambattur,455187
Adya Pandit,"14/627, Patel Nagar, Berhampur 869273",zinalsachdeva@example.net,https://chaudhary.com/,02671091758,Bakshi-Tank,English as a foreign language teacher,"Porro aut tempore nostrum. Blanditiis minima sequi dolorem harum corporis maiores ipsum.
Distinctio commodi in dolorem voluptatibus aut. Laboriosam nihil ipsa voluptas in harum.",2010-01-20 08:04:26,Montenegro,Nagaland,Sambalpur,149371
Qarin Suri,"272
Chacko Chowk
Hajipur-570050",avi49@example.org,http://www.iyengar.com/,07074802246,Mannan-Chad,Gaffer,"Labore magni accusamus assumenda assumenda excepturi sit. Et autem quia nostrum eos iusto provident.
Fugiat quod sed sapiente similique. Vero adipisci nisi reiciendis optio.",1973-08-08 10:41:19,Armenia,Karnataka,Yamunanagar,885493
Balhaar Sundaram,"H.No. 258
Rout
Alwar 675224",vedantraman@example.org,http://shukla.biz/,+917346128527,Pandya-Bali,Cabin crew,Magni doloribus sapiente esse doloremque sapiente dolorum. Asperiores inventore ad accusantium voluptatum. Expedita incidunt commodi architecto.,2019-12-17 18:14:15,Romania,Maharashtra,Medininagar,104420
Warinder Sarma,"18, Nazareth Street
Farrukhabad 647251",echacko@example.org,http://hayer-deshpande.net/,6296693791,Andra Ltd,Engineering geologist,"Occaecati temporibus optio incidunt. Exercitationem deserunt eaque.
Quisquam magnam quibusdam vel aut nesciunt asperiores. Asperiores commodi doloribus placeat.",2014-11-04 00:29:32,Suriname,Bihar,Bally,087129
Jagdish Char,"62/86, Nanda Street
Agartala 480939",tsharma@example.com,https://bala.net/,+917937513645,"Mannan, Bir and Ganguly",Gaffer,"Maiores voluptatem at. Voluptatem velit provident quo tempore autem.
Labore repellendus ad.",1980-04-17 18:34:46,Maldives,Nagaland,Navi Mumbai,519432
Sai Dutt,"H.No. 13, Nanda Marg, Meerut-728184",gopalanvi@example.org,http://www.dara.com/,02846110358,Trivedi PLC,Accounting technician,"Similique esse eum pariatur dolor veniam nostrum.
Vitae id harum dicta explicabo. Quasi illo temporibus mollitia dolor eius.
Doloribus voluptatum atque dolor sit. Minus nihil earum veritatis.",2004-02-07 05:10:41,Luxembourg,Manipur,Jabalpur,059847
Siya Nayar,"309, Vohra, Faridabad-313984",raviekta@example.org,http://www.bakshi.com/,+919239764666,"Soman, Dube and Goyal",Fitness centre manager,Nesciunt corrupti aspernatur rem dolore. Maiores expedita unde tenetur earum qui.,1971-01-29 15:49:54,Republic of the Congo,Tamil Nadu,Mahbubnagar,906884
Bhavya Panchal,"H.No. 085
Taneja Zila, Arrah 754837",hamsininatt@example.org,http://www.bose-sheth.info/,0697742813,"Murthy, Khalsa and Prashad",Dramatherapist,"Eligendi harum laborum amet.
Fugit similique rerum beatae consequuntur optio.
Sit itaque quisquam sint suscipit perspiciatis. Omnis tenetur quos cumque esse at.",2010-07-08 07:53:09,Liechtenstein,Nagaland,Suryapet,713896
Bishakha Comar,"51/66, Choudhary Chowk, Jaipur 222563",sathehemangini@example.net,https://www.din.com/,+911511096096,Gade PLC,Geophysical data processor,"Nostrum possimus explicabo fuga. Rem repellat provident vel quos. Nulla omnis laborum neque eveniet itaque non.
Quae quam maiores.
Amet vitae dignissimos voluptates eum eum. Autem placeat vel esse.",1994-11-23 12:00:47,Seychelles,Telangana,Secunderabad,413507
Xalak Chandran,"H.No. 07, Dutta Nagar, Raichur-183999",darikapalan@example.net,https://www.koshy-mody.com/,+911498874628,Nigam Ltd,"Accountant, chartered","Quos illo occaecati dolores. Quaerat temporibus reiciendis quisquam repellendus asperiores eum.
Tempore eaque illum provident sint. Incidunt dolore harum in.",1993-10-06 10:20:53,Uganda,Arunachal Pradesh,Katihar,836263
Harish Biswas,"H.No. 97, Khanna Path, Madurai-752345",kaderudra@example.org,http://www.kulkarni-tak.com/,07290669543,"Kurian, Oak and Dass",Personal assistant,Eaque dolorum eum exercitationem. Vero assumenda quaerat iure placeat exercitationem.,1990-05-10 17:26:08,East Timor,Sikkim,Bongaigaon,690299
Ojasvi Shah,"71/99, Desai Zila
Tiruppur-865559",nidrasodhi@example.com,http://www.barad.com/,4343581911,"Loyal, Chopra and Chaudhary","Research officer, trade union",Deleniti atque ex aspernatur est commodi exercitationem dolorum. Facere totam pariatur consectetur. Velit voluptate consequatur maiores ea nam deleniti.,1982-01-22 00:41:32,People's Republic of China,Rajasthan,Ulhasnagar,700844
Pahal Prabhakar,"76/64, Batra Path
Ozhukarai-628441",virajsathe@example.org,https://www.rajagopalan.com/,7314871662,Sawhney-Arya,Immunologist,"Inventore maxime neque recusandae officiis mollitia. Nemo placeat reiciendis reiciendis nesciunt laborum ea.
Porro ducimus id id id ut sed. Voluptate ut accusamus fuga veniam minus vitae.",1991-01-01 14:24:34,Antigua and Barbuda,Assam,South Dumdum,113741
Qarin Butala,"650
Krishnan, Thanjavur-465720",nigamlakshmi@example.com,https://www.apte.org/,2691099459,"Saraf, Buch and Bawa",Technical brewer,Totam odio dolore eaque id eius. Quod veritatis rem reiciendis ut tempora odio. Maxime enim ducimus mollitia ipsa asperiores.,1979-09-01 07:44:08,Palestine,Odisha,Bhilai,083451
Dhruv Garde,"62/254, Chahal Street, Mehsana 433666",lilaprabhakar@example.com,https://www.oak.com/,5369171901,Gulati-Walla,"Designer, interior/spatial",Deserunt repellat deserunt illo dolores repellendus. Aliquam odit rerum debitis cum fuga error. Quam commodi dolorem ratione iste incidunt perferendis soluta.,1986-04-06 17:13:07,Comoros,Tamil Nadu,Davanagere,735495
Dominic Shukla,"53/13
Kashyap Path, Delhi-868096",reyanshdugar@example.com,http://agrawal-tandon.net/,4502213879,"Ram, Vala and Bhattacharyya",Quarry manager,Quis accusantium ipsa odio repellendus dolores. Repudiandae harum atque quisquam. Fugit accusantium architecto quod fuga porro voluptatum.,1988-10-29 01:00:12,Eritrea,Punjab,Sikar,765520
Aarna Sahota,"H.No. 68, Mahal Chowk, Aizawl-642097",simonvenkatesh@example.com,http://www.sethi-grewal.com/,02925194701,"Sharma, Borra and Basu",Geographical information systems officer,Praesentium assumenda sint voluptatum accusantium nihil. Eveniet sit repudiandae officia corrupti itaque doloribus.,1997-08-15 16:49:39,The Gambia,Manipur,Kumbakonam,901037
Netra Kohli,"32/76, Parikh Zila
Panihati-283399",indali49@example.net,https://keer-dalal.info/,+910956708864,Deshmukh PLC,Politician's assistant,Quos tempora sequi sed. Praesentium porro possimus nam. Nisi magnam mollitia nostrum consequuntur.,1989-08-11 12:09:50,Egypt,Odisha,Guwahati,220177
Ijaya Krishnamurthy,"H.No. 38, Saha
Giridih 651084",dalaja83@example.org,http://dhar-rama.com/,3069889974,Misra-Guha,Chartered certified accountant,"Repellat corrupti necessitatibus temporibus aspernatur distinctio. Eius suscipit placeat rerum possimus quo. Incidunt accusamus harum laborum.
At modi debitis eligendi impedit.",2021-04-23 08:07:31,The Gambia,Himachal Pradesh,Moradabad,520006
Maanav Ray,"H.No. 59, Bandi Marg
Udupi-238387",yashasvi37@example.com,http://prakash-sabharwal.com/,+914125237675,Parmar Inc,Purchasing manager,"Soluta distinctio necessitatibus ad voluptatem hic. Facere similique officia voluptatibus non exercitationem error. Eum reprehenderit dignissimos est nam quidem.
Rerum ad molestias.",2023-05-14 10:53:00,Costa Rica,Kerala,Kirari Suleman Nagar,107978
Victor Anand,"H.No. 29
Dugal Nagar, Ludhiana-059538",triptimahal@example.com,http://www.taneja.info/,3158544018,"Barad, More and Thaker",Industrial buyer,"Amet ad corporis minus ducimus eum. Non eius quas a deleniti.
Natus molestiae officiis ratione vel.
Suscipit iusto amet. Natus expedita eligendi amet.",2010-04-16 00:34:46,People's Republic of China,Gujarat,Shimla,970217
Baljiwan Nori,"27/329, Sankaran Street
Bikaner-015464",ijayabutala@example.net,http://basak.com/,5399191417,Sur-Seth,Consulting civil engineer,"Maxime dolorem quisquam labore. Laborum unde illum nemo quis incidunt beatae provident.
Tempora earum voluptatem ducimus omnis velit recusandae aliquam.",2006-03-21 10:26:37,Iraq,Mizoram,North Dumdum,136927
Reyansh Ranganathan,"H.No. 88, Bora Zila, Durg 984452",dakshesh56@example.net,http://www.kant.com/,2412751287,"Balay, Gokhale and Char",Statistician,Molestias pariatur inventore fugit aliquid laborum repudiandae. Rem inventore autem ad occaecati.,2008-02-21 09:56:31,United States,Jharkhand,Bhatpara,113745
Hemang Dey,"31/06
Banerjee Ganj
Sonipat 768609",falan90@example.org,https://jaggi.com/,+918510439570,"Dara, Kumer and Sodhi","Production assistant, radio",Id cum sequi. Soluta quod facilis rem. Voluptates reprehenderit accusamus occaecati modi quo maxime.,2013-07-03 00:01:27,Dominica,Punjab,Kulti,951627
Niharika Balan,"34
Gade Ganj
Panipat-033308",nicholas02@example.com,http://www.garg.net/,+910457072114,Chokshi-Bhalla,Chartered management accountant,Minus perspiciatis vitae molestiae maxime voluptate ratione. Sequi maiores et adipisci. Sapiente exercitationem maxime quos ipsum.,1989-02-08 16:40:43,Denmark,Sikkim,Amravati,607926
Tripti Venkataraman,"H.No. 06, Halder Nagar, Morena-441817",chaudhariadweta@example.org,http://panchal-chand.info/,06443458951,Bala Inc,"Psychologist, clinical",Explicabo quibusdam harum. Excepturi maiores facilis consequuntur ratione. In laborum cum suscipit quisquam repudiandae optio.,1974-06-24 02:57:09,Trinidad and Tobago,Uttar Pradesh,Sagar,557532
Andrew Bhalla,"H.No. 18, Agate
Satna 182314",radha23@example.com,https://jayaraman.net/,+913323146390,Sunder and Sons,Armed forces logistics/support/administrative officer,Necessitatibus quidem temporibus labore laborum earum. Assumenda animi perferendis iste amet dolorum cupiditate sunt. Mollitia illum omnis pariatur. Magni quo minima vitae sequi dolores sint.,2010-10-22 19:47:03,South Africa,Gujarat,Lucknow,412412
Liam Toor,"657, Ramakrishnan Path, Hosur-443975",arunima00@example.org,https://venkatesh.net/,+919592776763,"Subramaniam, Balay and Bandi",Charity officer,"Nam fugit officia cumque fugiat fugiat ex. Corporis atque culpa non atque assumenda cumque. Error assumenda natus recusandae modi.
Tempora distinctio quo ipsum. Soluta ullam libero ipsum voluptas.",1993-09-10 06:48:08,Angola,Arunachal Pradesh,Mahbubnagar,687535
Gopal Joshi,"78/83, Sharma Chowk, Malda 598057",hritik15@example.org,https://modi.net/,+915571613388,"Aggarwal, Datta and Bedi",Patent examiner,"Consequatur nobis commodi labore totam iure.
Illo neque magnam at. Nemo dolor ab consequuntur aliquid sit corporis. Itaque ullam pariatur architecto repellat nihil molestiae.",2024-03-27 22:43:19,Romania,Rajasthan,Shahjahanpur,960917
Aradhana Thaman,"18/798, Sood
Kakinada 773645",zarna24@example.org,http://www.swamy-morar.com/,+913072256133,Madan and Sons,Operational researcher,"Enim commodi voluptate ipsam dolores ut sapiente alias. Atque eum occaecati vel soluta.
Cumque vero nostrum aliquid consequatur illo impedit reprehenderit.",1989-07-03 09:30:38,Afghanistan,Mizoram,Eluru,301045
Arya Barman,"H.No. 519
Toor Road
Panvel 179266",goswamiyatan@example.org,http://randhawa-raj.info/,+914912531884,Vyas-Memon,Naval architect,"Perspiciatis ut reprehenderit repudiandae.
In labore eligendi architecto minus error. Modi quia quam vel exercitationem deleniti commodi sint. Assumenda aliquam dolor ad fugiat quaerat sed.",1991-05-05 07:15:51,Turkmenistan,Mizoram,Allahabad,732004
Krishna Rao,"20/362
Ratti Road
Tinsukia-941075",dkeer@example.org,https://www.pall.com/,9863962064,Divan Group,Public affairs consultant,Commodi dolores exercitationem quisquam possimus. Nobis aliquid vel dignissimos cumque ratione reprehenderit. Aspernatur molestias quidem esse tempora minima.,1989-03-22 22:38:39,Germany,Uttar Pradesh,Kottayam,408130
Gavin Sha,"H.No. 53, Loyal Path, Tadipatri 685922",krishna20@example.org,https://www.choudhury-krish.com/,05632094295,Saha Ltd,Logistics and distribution manager,Omnis minus temporibus reprehenderit quo veniam amet. Culpa numquam nostrum dolorem ullam autem aut facere.,2004-08-23 22:43:28,Paraguay,Madhya Pradesh,Ichalkaranji,833298
Zashil Brahmbhatt,"69/34
Mistry Road
Malegaon-783040",dborra@example.com,https://www.johal.net/,1329944935,"Seth, Balan and Oza",Electronics engineer,Iure deserunt sapiente eos laudantium veritatis odio. Praesentium veniam laborum aspernatur distinctio illo sint placeat. Totam repellendus ut qui corrupti ullam beatae.,1975-06-12 16:38:15,Tajikistan,Meghalaya,Munger,984236
Riya Lal,"88
Mann Path, Kadapa-031877",skhurana@example.net,https://www.dutta.net/,05887266253,"Dube, Natarajan and Srivastava",Art gallery manager,"Asperiores nihil accusantium quasi.
Quaerat ipsam delectus reiciendis quae. Id occaecati quia totam voluptates maiores eos.
Et animi minus nemo. Culpa eveniet sequi quo quo occaecati iusto.",1976-10-04 21:35:54,Colombia,Arunachal Pradesh,Udupi,814858
Rajeshri Gola,"00/744, Lata Circle
Hazaribagh 606341",sakshamsharma@example.com,http://www.sem.com/,0422493247,Ravi-Soman,Horticultural consultant,Eum dolore nostrum illum ab. Sunt neque est sapiente in odio possimus.,2015-08-26 23:35:49,France,Andhra Pradesh,Firozabad,097112
